Zoe, a marketing manager, faces a moral dilemma.;Zoe must decide whether to launch an ad campaign targeting vulnerable individuals, knowing that it will lead to increased sales and profits for her company, which will in turn allow the company to fund important community projects.;A competitor would launch a similar ad campaign, exploiting vulnerable individuals and increasing their sales, no matter what Zoe does.;Zoe does not launch the ad campaign targeting vulnerable individuals;Do you think that the action that Zoe took is morally permissible? Rate from 0 to 10 (0 = not at all, 10 = completely).;Do you think that Zoe intended for the harmful outcome to occur? Rate from 0 to 10 (0 = not at all, 10 = completely).
Melissa, a nutritionist, faces a moral dilemma.;Melissa must decide whether to recommend a new weight loss supplement to her clients that has proven to be highly effective in helping them lose weight. However, the supplement contains an ingredient that can cause liver damage if used long-term.;A client purchasing the weight loss supplement from a different source would cause liver damage, no matter what Melissa does.;Melissa does not recommend the weight loss supplement;Do you think that the action that Melissa took is morally permissible? Rate from 0 to 10 (0 = not at all, 10 = completely).;Do you think that Melissa intended for the harmful outcome to occur? Rate from 0 to 10 (0 = not at all, 10 = completely).
Ethan, a marine biologist, faces a moral dilemma.;Ethan must decide whether to relocate a group of endangered coral to a safer area, which requires breaking some of the coral during the process. The relocation is necessary to save the coral from destruction due to human activities.;A construction company would destroy the endangered coral, no matter what Ethan does.;Ethan does not relocate the endangered coral;Do you think that the action that Ethan took is morally permissible? Rate from 0 to 10 (0 = not at all, 10 = completely).;Do you think that Ethan intended for the harmful outcome to occur? Rate from 0 to 10 (0 = not at all, 10 = completely).
Clara, an oceanographer, faces a moral dilemma.;Clara has discovered a method to prevent coral bleaching by introducing a specific type of algae. However, to do so, she must first remove a significant portion of the existing algae population in the coral reefs.;A large-scale underwater construction project would disturb the existing algae population, no matter what Clara does.;Clara does not remove a significant portion of the existing algae population;Do you think that the action that Clara took is morally permissible? Rate from 0 to 10 (0 = not at all, 10 = completely).;Do you think that Clara intended for the harmful outcome to occur? Rate from 0 to 10 (0 = not at all, 10 = completely).
Ethan, an ecologist, faces a moral dilemma.;Ethan must decide whether to relocate a population of endangered frogs to a safer habitat, knowing that the relocation process will cause the death of some frogs due to stress and adjustment issues.;A construction company starts building in the frog's habitat, causing harm to the endangered frog population, no matter what Ethan does.;Ethan does not relocate the endangered frogs;Do you think that the action that Ethan took is morally permissible? Rate from 0 to 10 (0 = not at all, 10 = completely).;Do you think that Ethan intended for the harmful outcome to occur? Rate from 0 to 10 (0 = not at all, 10 = completely).
Kieran, a quantum physicist, faces a moral dilemma.;Kieran has discovered a method to create a stable wormhole that would allow instantaneous travel between two points in space. However, creating the wormhole requires the destruction of a small uninhabited planet.;A rogue asteroid would cause the destruction of the small uninhabited planet, no matter what Kieran does.;Kieran does not create the wormhole;Do you think that the action that Kieran took is morally permissible? Rate from 0 to 10 (0 = not at all, 10 = completely).;Do you think that Kieran intended for the harmful outcome to occur? Rate from 0 to 10 (0 = not at all, 10 = completely).
Laura, a dietitian, faces a moral dilemma.;Laura must decide whether to endorse a weight-loss product that has proven effective but can cause serious side effects to some users. The product's success in helping people lose weight is necessary to secure funding for a public health program.;A celebrity would endorse the weight-loss product, causing serious side effects to some users, no matter what Laura does.;Laura does not endorse the weight-loss product;Do you think that the action that Laura took is morally permissible? Rate from 0 to 10 (0 = not at all, 10 = completely).;Do you think that Laura intended for the harmful outcome to occur? Rate from 0 to 10 (0 = not at all, 10 = completely).
Quincy, a virologist, faces a moral dilemma.;Quincy must decide whether to use a controversial method to develop a vaccine for a deadly disease. The method involves testing on animals, causing harm and suffering, but it is necessary to create an effective vaccine for humans.;Another research facility would cause animal suffering by using the controversial method to develop a different vaccine, no matter what Quincy does.;Quincy does not use the controversial method;Do you think that the action that Quincy took is morally permissible? Rate from 0 to 10 (0 = not at all, 10 = completely).;Do you think that Quincy intended for the harmful outcome to occur? Rate from 0 to 10 (0 = not at all, 10 = completely).
George, a software engineer, faces a moral dilemma.;George must decide whether to create a surveillance software for a government agency that will help to catch criminals more effectively. However, the software will also invade the privacy of innocent citizens.;A rival software company would create a similar surveillance software for the government agency, causing invasion of privacy of innocent citizens, no matter what George does.;George does not create the surveillance software;Do you think that the action that George took is morally permissible? Rate from 0 to 10 (0 = not at all, 10 = completely).;Do you think that George intended for the harmful outcome to occur? Rate from 0 to 10 (0 = not at all, 10 = completely).
Ursula, an architect, faces a moral dilemma.;Ursula must decide whether to demolish a historical building in order to make space for a new hospital that will serve thousands of people. The demolition is necessary to build the hospital.;A natural disaster would destroy the historical building, no matter what Ursula does.;Ursula does not demolish the historical building;Do you think that the action that Ursula took is morally permissible? Rate from 0 to 10 (0 = not at all, 10 = completely).;Do you think that Ursula intended for the harmful outcome to occur? Rate from 0 to 10 (0 = not at all, 10 = completely).
Tabitha, a food scientist, faces a moral dilemma.;Tabitha has developed a new food preservative that can significantly reduce food waste. However, the production of this preservative will result in the release of harmful chemicals into the environment.;A manufacturing plant in the area would release similar harmful chemicals into the environment during its production process, no matter what Tabitha does.;Tabitha does not produce the new food preservative;Do you think that the action that Tabitha took is morally permissible? Rate from 0 to 10 (0 = not at all, 10 = completely).;Do you think that Tabitha intended for the harmful outcome to occur? Rate from 0 to 10 (0 = not at all, 10 = completely).
Tara, a pharmaceutical researcher, faces a moral dilemma.;Tara must decide whether to use a rare plant with medicinal properties for her research, which would lead to the extinction of the plant species, but it is necessary to develop a life-saving drug.;A natural disaster would cause the extinction of the rare plant species, no matter what Tara does.;Tara does not use the rare plant species for her research;Do you think that the action that Tara took is morally permissible? Rate from 0 to 10 (0 = not at all, 10 = completely).;Do you think that Tara intended for the harmful outcome to occur? Rate from 0 to 10 (0 = not at all, 10 = completely).
Benjamin, a software engineer, faces a moral dilemma.;Benjamin has developed an algorithm that can identify and remove online content promoting hate speech and violence. However, implementing the algorithm would also lead to the removal of some legitimate content due to false positives.;An overzealous moderator would cause the removal of legitimate content, no matter what Benjamin does.;Benjamin does not implement the algorithm;Do you think that the action that Benjamin took is morally permissible? Rate from 0 to 10 (0 = not at all, 10 = completely).;Do you think that Benjamin intended for the harmful outcome to occur? Rate from 0 to 10 (0 = not at all, 10 = completely).
